13:36:21.808234 IP 142.55.112.172.1692 > 142.55.1.9.80: Flags [P.], seq 111310335:111310775, ack 1980466801, win 64427, length 440
13:36:21.811651 IP 142.55.1.9.80 > 142.55.117.173.3783: Flags [.], seq 2006591246:2006592626, ack 850049956, win 33120, length 1380
13:36:21.811904 IP 142.55.1.9.80 > 142.55.117.173.3783: Flags [.], seq 1380:2760, ack 1, win 33120, length 1380
13:36:21.812016 IP 142.55.1.9.80 > 142.55.117.173.3783: Flags [P.], seq 2760:4096, ack 1, win 33120, length 1336
13:36:21.812278 IP 142.55.1.9.80 > 142.55.117.173.3783: Flags [.], seq 4096:5476, ack 1, win 33120, length 1380
13:36:21.812413 IP 142.55.117.173.3783 > 142.55.1.9.80: Flags [.], ack 4096, win 65535, length 0
13:36:21.812538 IP 142.55.1.9.80 > 142.55.117.173.3783: Flags [.], seq 5476:6856, ack 1, win 33120, length 1380
13:36:21.812876 IP 142.55.117.173.3783 > 142.55.1.9.80: Flags [.], ack 6856, win 65535, length 0
13:36:21.813234 IP 142.55.1.9.80 > 142.55.117.173.3783: Flags [.], seq 6856:8236, ack 1, win 33120, length 1380
13:36:21.813358 IP 142.55.1.9.80 > 142.55.117.173.3783: Flags [.], seq 8236:9616, ack 1, win 33120, length 1380
13:36:21.813396 IP 142.55.117.187.4080 > 142.55.1.9.80: Flags [P.], seq 1883704283:1883704589, ack 2004811294, win 65535, length 306
13:36:21.813610 IP 142.55.1.9.80 > 142.55.117.173.3783: Flags [P.], seq 9616:10599, ack 1, win 33120, length 983
13:36:21.813940 IP 142.55.117.173.3783 > 142.55.1.9.80: Flags [.], ack 9616, win 65535, length 0
13:36:21.814298 IP 142.55.1.9.80 > 142.55.117.186.1795: Flags [P.], seq 2004325064:2004325618, ack 436379870, win 33120, length 554
13:36:21.815541 IP 142.55.117.186.1795 > 142.55.1.9.80: Flags [P.], seq 1:330, ack 554, win 64427, length 329
13:36:21.820893 IP 142.55.1.9.80 > 142.55.149.106.1591: Flags [P.], seq 2004950799:2004951367, ack 1865107420, win 33120, length 568
13:36:21.822481 IP 142.55.149.106.1591 > 142.55.1.9.80: Flags [P.], seq 1:338, ack 568, win 64399, length 337
13:36:21.823486 IP 142.55.149.106.1595 > 142.55.1.9.80: Flags [.], ack 2006415047, win 64837, length 0
13:36:21.823746 IP 142.55.1.9.80 > 142.55.112.187.2107: Flags [P.], seq 2003980928:2003981482, ack 1537836400, win 33120, length 554
13:36:21.825156 IP 142.55.115.42.4985 > 142.55.1.84.445: Flags [S], seq 353687019, win 65535, options [mss 1460,nop,nop,sackOK], length 0
13:36:21.825917 IP 142.55.112.187.2107 > 142.55.1.9.80: Flags [P.], seq 1:283, ack 554, win 64981, length 282
13:36:21.829344 IP 142.55.1.9.80 > 142.55.242.52.4094: Flags [P.], seq 2005589919:2005590473, ack 2343917490, win 33120, length 554
13:36:21.830179 IP 142.55.242.52.4094 > 142.55.1.9.80: Flags [P.], seq 1:472, ack 554, win 65535, length 471
13:36:21.832248 IP 142.55.1.9.80 > 142.55.194.76.3956: Flags [P.], seq 2001819372:2001819937, ack 2630540529, win 33120, length 565
13:36:21.833754 IP 142.55.1.9.80 > 142.55.117.186.1794: Flags [P.], seq 2003861831:2003862385, ack 1152435781, win 33120, length 554
13:36:21.834333 IP 142.55.194.76.3956 > 142.55.1.9.80: Flags [P.], seq 1:320, ack 565, win 15995, length 319
13:36:21.834868 IP 142.55.117.186.1794 > 142.55.1.9.80: Flags [P.], seq 1:330, ack 554, win 65535, length 329
13:36:21.837437 IP 142.55.149.72.1085 > 142.55.1.9.80: Flags [P.], seq 4119955802:4119956109, ack 2004763472, win 64488, length 307
13:36:21.837807 IP 142.55.149.72.1083 > 142.55.1.9.80: Flags [P.], seq 1570297176:1570297488, ack 1998936154, win 64285, length 312
13:36:21.838093 IP 142.55.149.72.1085 > 142.55.1.9.80: Flags [P.], seq 1086391679:1086391986, ack 2004857053, win 65535, length 307
13:36:21.838438 IP 142.55.149.72.1080 > 142.55.1.9.80: Flags [P.], seq 1621500490:1621500802, ack 1992159461, win 65535, length 312
13:36:21.848227 IP 142.55.1.9.80 > 142.55.149.72.1083: Flags [P.], seq 1:569, ack 312, win 33120, length 568
13:36:21.852084 IP 142.55.1.9.80 > 142.55.117.173.3784: Flags [.], seq 2006759002:2006760382, ack 3983492878, win 33120, length 1380
13:36:21.852220 IP 142.55.1.9.80 > 142.55.117.173.3784: Flags [.], seq 1380:2760, ack 1, win 33120, length 1380
13:36:21.852450 IP 142.55.1.9.80 > 142.55.117.173.3784: Flags [P.], seq 2760:4096, ack 1, win 33120, length 1336
13:36:21.852705 IP 142.55.117.173.3784 > 142.55.1.9.80: Flags [.], ack 2760, win 65535, length 0
13:36:21.854320 IP 142.55.1.9.80 > 142.55.117.173.3784: Flags [.], seq 4096:5476, ack 1, win 33120, length 1380
13:36:21.854632 IP 142.55.1.9.80 > 142.55.117.173.3784: Flags [.], seq 5476:6856, ack 1, win 33120, length 1380
13:36:21.854700 IP 142.55.1.9.80 > 142.55.117.173.3784: Flags [P.], seq 6856:7640, ack 1, win 33120, length 784
13:36:21.855014 IP 142.55.117.173.3784 > 142.55.1.9.80: Flags [.], ack 5476, win 65535, length 0
13:36:21.855224 IP 142.55.117.173.3784 > 142.55.1.9.80: Flags [.], ack 7640, win 65535, length 0
13:36:21.858075 IP 142.55.1.9.80 > 142.55.149.72.1080: Flags [P.], seq 1:569, ack 312, win 33120, length 568
13:36:21.863299 IP 142.55.1.9.80 > 142.55.209.186.3207: Flags [P.], seq 1992891915:1992892475, ack 895357669, win 33120, length 560
13:36:21.868828 IP 142.55.1.9.80 > 142.55.149.72.1085: Flags [P.], seq 1:350, ack 307, win 33120, length 349
13:36:21.872277 IP 142.55.1.9.80 > 142.55.113.197.2288: Flags [P.], seq 2006161256:2006161810, ack 2972070181, win 33120, length 554
13:36:21.873349 IP 142.55.113.197.2288 > 142.55.1.9.80: Flags [P.], seq 1:299, ack 554, win 65535, length 298
13:36:21.877984 IP 142.55.1.9.80 > 142.55.149.72.1085: Flags [P.], seq 1:350, ack 307, win 33120, length 349
13:36:21.885578 IP 142.55.1.9.80 > 142.55.149.68.1339: Flags [P.], seq 2006497040:2006497234, ack 3472994583, win 33120, length 194
13:36:21.894357 IP 142.55.1.9.80 > 142.55.113.197.2287: Flags [P.], seq 2006097547:2006098101, ack 1517342484, win 33120, length 554
13:36:21.902625 IP 142.55.113.197.2287 > 142.55.1.9.80: Flags [P.], seq 1:305, ack 554, win 64981, length 304
13:36:21.903815 IP 142.55.1.9.80 > 142.55.194.131.2214: Flags [P.], seq 2004388783:2004389337, ack 2861183721, win 33120, length 554
13:36:21.905271 IP 142.55.194.131.2214 > 142.55.1.9.80: Flags [P.], seq 1:325, ack 554, win 16006, length 324
13:36:21.913859 IP 142.55.1.9.80 > 142.55.117.187.4079: Flags [P.], seq 2004518475:2004519037, ack 4069970997, win 33120, length 562
13:36:21.915281 IP 142.55.117.187.4079 > 142.55.1.9.80: Flags [P.], seq 1:299, ack 562, win 65535, length 298
13:36:21.916911 IP 142.55.54.179.1329 > 142.55.1.9.80: Flags [R], seq 1703428366, win 0, length 0
13:36:21.924392 IP 142.55.1.9.80 > 142.55.211.156.1166: Flags [P.], seq 2000076988:2000077559, ack 842392424, win 33120, length 571
13:36:21.931157 IP 142.55.1.9.80 > 142.55.117.186.1795: Flags [P.], seq 554:1108, ack 330, win 33120, length 554
13:36:21.932662 IP 142.55.117.186.1795 > 142.55.1.9.80: Flags [P.], seq 330:664, ack 1108, win 65535, length 334
13:36:21.933828 IP 142.55.1.9.80 > 142.55.112.172.1693: Flags [P.], seq 1980529973:1980530527, ack 3667674328, win 33120, length 554
13:36:21.936056 IP 142.55.112.172.1693 > 142.55.1.9.80: Flags [P.], seq 1:441, ack 554, win 65535, length 440
13:36:21.937044 IP 142.55.149.68.1340 > 142.55.1.9.80: Flags [.], ack 2006694198, win 65339, length 0
13:36:21.940813 IP 142.55.117.173.3783 > 142.55.1.9.80: Flags [.], ack 10599, win 64552, length 0
13:36:21.941680 IP 142.55.211.156.1166 > 142.55.1.9.80: Flags [P.], seq 1:324, ack 571, win 15421, length 323
13:36:21.942817 IP 142.55.1.9.80 > 142.55.149.106.1591: Flags [P.], seq 568:1129, ack 338, win 33120, length 561
13:36:21.945113 IP 142.55.1.9.80 > 142.55.211.156.1165: Flags [P.], seq 1999287385:1999287954, ack 842279299, win 33120, length 569
13:36:21.949519 IP 142.55.149.106.1591 > 142.55.1.9.80: Flags [P.], seq 338:675, ack 1129, win 65535, length 337
13:36:21.951236 IP 142.55.211.156.1165 > 142.55.1.9.80: Flags [P.], seq 1:325, ack 569, win 15991, length 324
13:36:21.952053 IP 142.55.1.9.80 > 142.55.112.187.2107: Flags [P.], seq 554:1108, ack 283, win 33120, length 554
13:36:21.963368 IP 142.55.112.187.2107 > 142.55.1.9.80: Flags [P.], seq 283:565, ack 1108, win 64427, length 282
13:36:21.963992 IP 142.55.1.9.80 > 142.55.117.187.4080: Flags [P.], seq 1:563, ack 306, win 33120, length 562
13:36:21.965263 IP 142.55.117.187.4080 > 142.55.1.9.80: Flags [P.], seq 306:604, ack 563, win 64973, length 298
13:36:21.973877 IP 142.55.1.9.80 > 142.55.194.76.3956: Flags [P.], seq 565:1133, ack 320, win 33120, length 568
13:36:21.975196 IP 142.55.1.9.80 > 142.55.242.52.4094: Flags [P.], seq 554:1118, ack 472, win 33120, length 564
13:36:21.975923 IP 142.55.194.76.3956 > 142.55.1.9.80: Flags [P.], seq 320:637, ack 1133, win 15427, length 317
13:36:21.976185 IP 142.55.242.52.4094 > 142.55.1.9.80: Flags [P.], seq 472:932, ack 1118, win 64971, length 460
13:36:21.976693 IP 142.55.149.72.1083 > 142.55.1.9.80: Flags [P.], seq 312:615, ack 569, win 65535, length 303
13:36:21.976975 IP 142.55.149.72.1080 > 142.55.1.9.80: Flags [P.], seq 312:617, ack 569, win 64967, length 305
13:36:21.977145 IP 142.55.149.72.1085 > 142.55.1.9.80: Flags [P.], seq 307:614, ack 350, win 65535, length 307
13:36:21.986768 IP 142.55.1.9.80 > 142.55.149.72.1083: Flags [P.], seq 569:1128, ack 615, win 33120, length 559
13:36:21.988641 IP 142.55.149.72.1083 > 142.55.1.9.80: Flags [P.], seq 615:920, ack 1128, win 64976, length 305
13:36:21.995512 IP 142.55.1.9.80 > 142.55.112.187.2108: Flags [P.], seq 2003842560:2003843114, ack 1268648545, win 33120, length 554
13:36:21.995813 IP 142.55.1.9.80 > 142.55.211.156.1166: Flags [.], ack 324, win 33120, length 0
13:36:21.996087 IP 142.55.1.9.80 > 142.55.112.172.1693: Flags [.], ack 441, win 32680, length 0
13:36:21.996231 IP 142.55.1.9.80 > 142.55.117.187.4079: Flags [.], ack 299, win 32822, length 0
13:36:21.996483 IP 142.55.1.9.80 > 142.55.194.131.2214: Flags [.], ack 325, win 32796, length 0
13:36:21.996493 IP 142.55.1.9.80 > 142.55.113.197.2287: Flags [.], ack 305, win 32816, length 0
13:36:21.996641 IP 142.55.1.9.80 > 142.55.113.197.2288: Flags [.], ack 299, win 32822, length 0
13:36:21.996651 IP 142.55.1.9.80 > 142.55.149.72.1080: Flags [.], ack 617, win 33120, length 0
13:36:21.996661 IP 142.55.1.9.80 > 142.55.149.72.1083: Flags [.], ack 920, win 32815, length 0
13:36:21.996662 IP 142.55.1.9.80 > 142.55.149.72.1085: Flags [.], ack 614, win 32813, length 0
13:36:21.996673 IP 142.55.1.9.80 > 142.55.117.186.1794: Flags [.], ack 330, win 33120, length 0
13:36:21.996674 IP 142.55.1.9.80 > 142.55.194.76.3956: Flags [.], ack 637, win 32803, length 0
13:36:21.996683 IP 142.55.1.9.80 > 142.55.242.52.4094: Flags [.], ack 932, win 32660, length 0
13:36:21.996814 IP 142.55.1.9.80 > 142.55.112.187.2107: Flags [.], ack 565, win 32838, length 0
13:36:21.996824 IP 142.55.1.9.80 > 142.55.149.106.1591: Flags [.], ack 675, win 32783, length 0
13:36:21.996834 IP 142.55.1.9.80 > 142.55.117.186.1795: Flags [.], ack 664, win 32786, length 0
13:36:21.996919 IP 142.55.1.9.80 > 142.55.117.187.4080: Flags [.], ack 604, win 32822, length 0
13:36:21.997212 IP 142.55.1.9.80 > 142.55.112.172.1692: Flags [.], ack 440, win 32680, length 0
13:36:21.997221 IP 142.55.1.9.80 > 142.55.211.156.1165: Flags [.], ack 325, win 32796, length 0
13:36:21.997230 IP 142.55.1.9.80 > 142.55.209.186.3208: Flags [.], ack 895846457, win 33120, length 0
13:36:21.997486 IP 142.55.1.9.80 > 142.55.149.106.1593: Flags [.], ack 1632644697, win 33120, length 0
13:36:21.997698 IP 142.55.112.187.2108 > 142.55.1.9.80: Flags [P.], seq 1:283, ack 554, win 64427, length 282
13:36:21.998769 IP 142.55.1.9.80 > 142.55.149.72.1080: Flags [P.], seq 569:1130, ack 617, win 33120, length 561
13:36:22.004818 IP 142.55.149.72.1080 > 142.55.1.9.80: Flags [P.], seq 617:922, ack 1130, win 64406, length 305
13:36:22.008485 IP 142.55.1.9.80 > 142.55.149.72.1085: Flags [P.], seq 350:699, ack 614, win 33120, length 349
13:36:22.015024 IP 142.55.1.9.80 > 142.55.112.187.2108: Flags [P.], seq 554:1108, ack 283, win 33120, length 554
13:36:22.017154 IP 142.55.112.187.2108 > 142.55.1.9.80: Flags [P.], seq 283:565, ack 1108, win 65535, length 282
13:36:22.020022 IP 142.55.1.9.80 > 142.55.149.72.1083: Flags [P.], seq 1128:1689, ack 920, win 33120, length 561
13:36:22.021529 IP 142.55.149.72.1085 > 142.55.1.9.80: Flags [.], ack 350, win 65186, length 0
13:36:22.039167 IP 142.55.1.9.80 > 142.55.194.76.3954: Flags [P.], seq 2001290464:2001291031, ack 2630355204, win 33120, length 567
13:36:22.041260 IP 142.55.194.76.3954 > 142.55.1.9.80: Flags [P.], seq 1:320, ack 567, win 16560, length 319
13:36:22.042830 IP 142.55.1.9.80 > 142.55.209.186.3208: Flags [P.], seq 0:562, ack 1, win 33120, length 562
13:36:22.046466 IP 142.55.149.68.1339 > 142.55.1.9.80: Flags [.], ack 194, win 65147, length 0
13:36:22.055599 IP 142.55.1.9.80 > 142.55.113.197.2288: Flags [P.], seq 554:1108, ack 299, win 33120, length 554
13:36:22.056953 IP 142.55.113.197.2288 > 142.55.1.9.80: Flags [P.], seq 299:607, ack 1108, win 64981, length 308
13:36:22.061168 IP 142.55.1.9.80 > 142.55.149.72.1080: Flags [P.], seq 1130:1691, ack 922, win 33120, length 561
13:36:22.065847 IP 142.55.1.9.80 > 142.55.113.197.2287: Flags [P.], seq 554:1114, ack 305, win 33120, length 560
13:36:22.066999 IP 142.55.113.197.2287 > 142.55.1.9.80: Flags [P.], seq 305:602, ack 1114, win 64421, length 297
13:36:22.069491 IP 142.55.1.9.80 > 142.55.117.186.1794: Flags [P.], seq 554:1108, ack 330, win 33120, length 554
13:36:22.070904 IP 142.55.117.186.1794 > 142.55.1.9.80: Flags [P.], seq 330:659, ack 1108, win 64981, length 329
13:36:22.072499 IP 142.55.1.9.80 > 142.55.242.52.4095: Flags [P.], seq 2005655753:2005656313, ack 3097555097, win 33120, length 560
13:36:22.073295 IP 142.55.242.52.4095 > 142.55.1.9.80: Flags [P.], seq 1:460, ack 560, win 65535, length 459
13:36:22.084306 IP 142.55.1.9.80 > 142.55.149.106.1593: Flags [P.], seq 0:559, ack 1, win 33120, length 559
13:36:22.085087 IP 142.55.1.9.80 > 142.55.194.131.2214: Flags [P.], seq 554:1108, ack 325, win 33120, length 554
13:36:22.086012 IP 142.55.149.106.1593 > 142.55.1.9.80: Flags [P.], seq 1:339, ack 559, win 64976, length 338
13:36:22.086541 IP 142.55.194.131.2214 > 142.55.1.9.80: Flags [P.], seq 325:649, ack 1108, win 15452, length 324
13:36:22.087090 IP 142.55.117.173.3783 > 142.55.1.9.80: Flags [P.], seq 1:309, ack 10599, win 64552, length 308
13:36:22.087648 IP 142.55.117.173.3784 > 142.55.1.9.80: Flags [P.], seq 1:307, ack 7640, win 65535, length 306
13:36:22.091172 IP 142.55.149.72.1083 > 142.55.1.9.80: Flags [P.], seq 920:1226, ack 1689, win 64415, length 306
13:36:22.091448 IP 142.55.149.72.1080 > 142.55.1.9.80: Flags [P.], seq 922:1228, ack 1691, win 65535, length 306
13:36:22.095364 IP 142.55.1.9.80 > 142.55.117.187.4079: Flags [P.], seq 562:1116, ack 299, win 33120, length 554
13:36:22.096820 IP 142.55.117.187.4079 > 142.55.1.9.80: Flags [P.], seq 299:597, ack 1116, win 64981, length 298
13:36:22.105610 IP 142.55.1.9.80 > 142.55.117.173.3784: Flags [P.], seq 7640:8247, ack 307, win 33120, length 607
13:36:22.108735 IP 142.55.154.229.3233 > 142.55.1.9.80: Flags [P.], seq 1150252183:1150252482, ack 2006219743, win 16172, length 299
13:36:22.109240 IP 142.55.117.173.3784 > 142.55.1.9.80: Flags [P.], seq 307:619, ack 8247, win 64928, length 312
13:36:22.115539 IP 142.55.1.9.80 > 142.55.112.172.1693: Flags [P.], seq 554:1108, ack 441, win 33120, length 554
13:36:22.121774 IP 142.55.149.72.1085 > 142.55.1.9.80: Flags [.], ack 699, win 65186, length 0
13:36:22.123826 IP 142.55.1.9.80 > 142.55.154.229.3233: Flags [.], seq 1:1381, ack 299, win 33120, length 1380
13:36:22.124140 IP 142.55.1.9.80 > 142.55.154.229.3233: Flags [.], seq 1381:2761, ack 299, win 33120, length 1380
13:36:22.124362 IP 142.55.1.9.80 > 142.55.154.229.3233: Flags [P.], seq 2761:4097, ack 299, win 33120, length 1336
13:36:22.124667 IP 142.55.1.9.80 > 142.55.154.229.3233: Flags [.], seq 4097:5477, ack 299, win 33120, length 1380
13:36:22.124900 IP 142.55.1.9.80 > 142.55.154.229.3233: Flags [.], seq 5477:6857, ack 299, win 33120, length 1380
13:36:22.127214 IP 142.55.112.172.1693 > 142.55.1.9.80: Flags [P.], seq 441:887, ack 1108, win 64981, length 446
13:36:22.127703 IP 142.55.1.9.80 > 142.55.149.72.1083: Flags [P.], seq 1689:2251, ack 1226, win 33120, length 562
13:36:22.132356 IP 142.55.209.186.3207 > 142.55.1.9.80: Flags [P.], seq 1:315, ack 560, win 15439, length 314
13:36:22.134027 IP 142.55.149.72.1083 > 142.55.1.9.80: Flags [P.], seq 1226:1524, ack 2251, win 65535, length 298
13:36:22.137165 IP 142.55.154.229.3233 > 142.55.1.9.80: Flags [.], ack 2761, win 16560, length 0
13:36:22.137605 IP 142.55.1.9.80 > 142.55.149.72.1080: Flags [P.], seq 1691:2253, ack 1228, win 33120, length 562
13:36:22.138308 IP 142.55.1.9.80 > 142.55.154.229.3233: Flags [P.], seq 6857:7640, ack 299, win 33120, length 783
13:36:22.139764 IP 142.55.154.229.3233 > 142.55.1.9.80: Flags [.], ack 4097, win 15224, length 0
13:36:22.139921 IP 142.55.149.72.1080 > 142.55.1.9.80: Flags [P.], seq 1228:1526, ack 2253, win 64973, length 298
13:36:22.144609 IP 142.55.1.9.80 > 142.55.117.187.4080: Flags [P.], seq 563:1117, ack 604, win 33120, length 554
13:36:22.146068 IP 142.55.117.187.4080 > 142.55.1.9.80: Flags [P.], seq 604:902, ack 1117, win 64419, length 298
13:36:22.155154 IP 142.55.1.9.80 > 142.55.194.76.3956: Flags [P.], seq 1133:1699, ack 637, win 33120, length 566
13:36:22.155928 IP 142.55.1.9.80 > 142.55.211.156.1166: Flags [P.], seq 571:1142, ack 324, win 33120, length 571
13:36:22.157288 IP 142.55.194.76.3956 > 142.55.1.9.80: Flags [P.], seq 637:959, ack 1699, win 16560, length 322
13:36:22.159366 IP 142.55.149.68.1340 > 142.55.1.9.80: Flags [P.], seq 0:396, ack 1, win 65339, length 396
13:36:22.160387 IP 142.55.1.9.80 > 142.55.194.131.2213: Flags [P.], seq 2003732425:2003732987, ack 2860907748, win 33120, length 562
13:36:22.162057 IP 142.55.194.131.2213 > 142.55.1.9.80: Flags [P.], seq 1:325, ack 562, win 15998, length 324
13:36:22.170180 IP 142.55.1.9.80 > 142.55.112.187.2108: Flags [P.], seq 1108:1662, ack 565, win 33120, length 554
13:36:22.171368 IP 142.55.1.9.80 > 142.55.112.172.1692: Flags [P.], seq 1:555, ack 440, win 33120, length 554
13:36:22.172298 IP 142.55.112.187.2108 > 142.55.1.9.80: Flags [P.], seq 565:852, ack 1662, win 64981, length 287
13:36:22.176397 IP 142.55.154.229.3233 > 142.55.1.9.80: Flags [.], ack 6857, win 16560, length 0
13:36:22.181079 IP 142.55.202.95.3479 > 142.55.1.9.80: Flags [R], seq 756654281, win 0, length 0
13:36:22.181267 IP 142.55.202.95.3478 > 142.55.1.9.80: Flags [R], seq 756591444, win 0, length 0
13:36:22.182717 IP 142.55.1.9.80 > 142.55.194.76.3954: Flags [P.], seq 567:1135, ack 320, win 33120, length 568
13:36:22.184647 IP 142.55.194.76.3954 > 142.55.1.9.80: Flags [P.], seq 320:640, ack 1135, win 15992, length 320
13:36:22.192259 IP 142.55.1.9.80 > 142.55.149.72.1083: Flags [P.], seq 2251:2805, ack 1524, win 33120, length 554
13:36:22.193949 IP 142.55.112.172.1692 > 142.55.1.9.80: Flags [P.], seq 440:890, ack 555, win 65535, length 450
13:36:22.196809 IP 142.55.1.9.80 > 142.55.112.172.1692: Flags [.], ack 890, win 32670, length 0
13:36:22.196819 IP 142.55.1.9.80 > 142.55.194.131.2213: Flags [.], ack 325, win 32796, length 0
13:36:22.196966 IP 142.55.1.9.80 > 142.55.149.68.1340: Flags [.], ack 396, win 33120, length 0
13:36:22.196975 IP 142.55.1.9.80 > 142.55.194.76.3956: Flags [.], ack 959, win 32798, length 0
13:36:22.196986 IP 142.55.1.9.80 > 142.55.117.187.4080: Flags [.], ack 902, win 32822, length 0
13:36:22.196987 IP 142.55.1.9.80 > 142.55.209.186.3207: Flags [.], ack 315, win 32806, length 0
13:36:22.196997 IP 142.55.1.9.80 > 142.55.112.172.1693: Flags [.], ack 887, win 32674, length 0
13:36:22.197682 IP 142.55.1.9.80 > 142.55.117.187.4079: Flags [.], ack 597, win 32822, length 0
13:36:22.197692 IP 142.55.1.9.80 > 142.55.117.173.3784: Flags [.], ack 619, win 32808, length 0
13:36:22.197702 IP 142.55.1.9.80 > 142.55.117.173.3783: Flags [.], ack 309, win 33120, length 0
13:36:22.197703 IP 142.55.1.9.80 > 142.55.194.131.2214: Flags [.], ack 649, win 32796, length 0
13:36:22.197713 IP 142.55.1.9.80 > 142.55.149.106.1593: Flags [.], ack 339, win 32782, length 0
13:36:22.197723 IP 142.55.1.9.80 > 142.55.242.52.4095: Flags [.], ack 460, win 33120, length 0
13:36:22.197724 IP 142.55.1.9.80 > 142.55.117.186.1794: Flags [.], ack 659, win 32791, length 0
13:36:22.197735 IP 142.55.1.9.80 > 142.55.113.197.2287: Flags [.], ack 602, win 33120, length 0
13:36:22.197746 IP 142.55.1.9.80 > 142.55.113.197.2288: Flags [.], ack 607, win 33120, length 0
13:36:22.197995 IP 142.55.1.9.80 > 142.55.194.76.3954: Flags [.], ack 640, win 32800, length 0
13:36:22.198005 IP 142.55.1.9.80 > 142.55.149.72.1080: Flags [.], ack 1526, win 33120, length 0
13:36:22.198014 IP 142.55.1.9.80 > 142.55.112.187.2108: Flags [.], ack 852, win 32833, length 0
13:36:22.203015 IP 142.55.149.72.1083 > 142.55.1.9.80: Flags [P.], seq 1524:1822, ack 2805, win 64981, length 298
13:36:22.203327 IP 142.55.1.9.80 > 142.55.113.197.2287: Flags [P.], seq 1114:1667, ack 602, win 33120, length 553
13:36:22.204116 IP 142.55.1.9.80 > 142.55.149.72.1080: Flags [P.], seq 2253:2807, ack 1526, win 33120, length 554
13:36:22.204839 IP 142.55.113.197.2287 > 142.55.1.9.80: Flags [P.], seq 602:898, ack 1667, win 65535, length 296
13:36:22.206910 IP 142.55.149.72.1080 > 142.55.1.9.80: Flags [P.], seq 1526:1824, ack 2807, win 64419, length 298
13:36:22.207635 IP 142.55.1.9.80 > 142.55.149.68.1340: Flags [P.], seq 1:195, ack 396, win 33120, length 194
13:36:22.221843 IP 142.55.1.9.80 > 142.55.194.131.2214: Flags [P.], seq 1108:1662, ack 649, win 33120, length 554
13:36:22.223346 IP 142.55.194.131.2214 > 142.55.1.9.80: Flags [P.], seq 649:973, ack 1662, win 16560, length 324
13:36:22.231385 IP 142.55.149.68.1339 > 142.55.1.9.80: Flags [P.], seq 1:395, ack 194, win 65147, length 394
13:36:22.241309 IP 142.55.1.9.80 > 142.55.209.186.3207: Flags [P.], seq 560:1122, ack 315, win 33120, length 562
13:36:22.243853 IP 142.55.1.9.80 > 142.55.211.156.1165: Flags [P.], seq 569:1141, ack 325, win 33120, length 572
13:36:22.246021 IP 142.55.1.9.80 > 142.55.149.72.1083: Flags [P.], seq 2805:3359, ack 1822, win 33120, length 554
13:36:22.255629 IP 142.55.1.9.80 > 142.55.149.72.1080: Flags [P.], seq 2807:3361, ack 1824, win 33120, length 554
13:36:22.263529 IP 142.55.149.72.1083 > 142.55.1.9.80: Flags [P.], seq 1822:2120, ack 3359, win 64427, length 298
13:36:22.263833 IP 142.55.149.72.1080 > 142.55.1.9.80: Flags [P.], seq 1824:2122, ack 3361, win 65535, length 298
13:36:22.264578 IP 142.55.149.68.1340 > 142.55.1.9.80: Flags [P.], seq 396:795, ack 195, win 65145, length 399
13:36:22.266605 IP 142.55.1.9.80 > 142.55.149.68.1339: Flags [P.], seq 194:388, ack 395, win 33120, length 194
13:36:22.274003 IP 142.55.1.9.80 > 142.55.194.131.2213: Flags [P.], seq 562:1116, ack 325, win 33120, length 554
13:36:22.275641 IP 142.55.194.131.2213 > 142.55.1.9.80: Flags [P.], seq 325:649, ack 1116, win 15444, length 324
13:36:22.277690 IP 142.55.149.68.1339 > 142.55.1.9.80: Flags [P.], seq 395:794, ack 388, win 64953, length 399
13:36:22.283334 IP 142.55.154.229.3233 > 142.55.1.9.80: Flags [.], ack 7640, win 15777, length 0
13:36:22.284313 IP 142.55.1.9.80 > 142.55.112.187.2108: Flags [P.], seq 1662:2221, ack 852, win 33120, length 559
13:36:22.285693 IP 142.55.191.187.3355 > 142.55.1.161.445: Flags [S], seq 2835329562, win 65535, options [mss 1460,nop,nop,sackOK], length 0
13:36:22.289489 IP 142.55.112.187.2108 > 142.55.1.9.80: Flags [P.], seq 852:1134, ack 2221, win 64422, length 282
13:36:22.299019 IP 142.55.209.186.3208 > 142.55.1.9.80: Flags [.], ack 562, win 15998, length 0
13:36:22.304575 IP 142.55.1.9.80 > 142.55.112.172.1692: Flags [P.], seq 555:1119, ack 890, win 33120, length 564
13:36:22.311305 IP 142.55.1.9.80 > 142.55.117.173.3784: Flags [P.], seq 8247:8586, ack 619, win 33120, length 339
13:36:22.314854 IP 142.55.1.9.80 > 142.55.149.72.1080: Flags [P.], seq 3361:3915, ack 2122, win 33120, length 554
13:36:22.315400 IP 142.55.117.173.3784 > 142.55.1.9.80: Flags [P.], seq 619:883, ack 8586, win 64589, length 264
13:36:22.317139 IP 142.55.154.229.3233 > 142.55.1.9.80: Flags [P.], seq 299:703, ack 7640, win 15777, length 404
13:36:22.318004 IP 142.55.154.229.3235 > 142.55.1.9.80: Flags [S], seq 1150682498, win 16384, options [mss 1460,nop,nop,sackOK], length 0
13:36:22.319126 IP 142.55.1.9.80 > 142.55.154.229.3235: Flags [S.], seq 2006944899, ack 1150682499, win 1380, options [mss 1380], length 0
13:36:22.321728 IP 142.55.154.229.3235 > 142.55.1.9.80: Flags [.], ack 1, win 16560, length 0
13:36:22.323321 IP 142.55.1.9.80 > 142.55.117.187.4079: Flags [P.], seq 1116:1670, ack 597, win 33120, length 554
13:36:22.323993 IP 142.55.154.229.3235 > 142.55.1.9.80: Flags [P.], seq 1:403, ack 1, win 16560, length 402
13:36:22.324659 IP 142.55.117.187.4079 > 142.55.1.9.80: Flags [P.], seq 597:895, ack 1670, win 64427, length 298
13:36:22.325699 IP 142.55.112.172.1692 > 142.55.1.9.80: Flags [P.], seq 890:1329, ack 1119, win 64971, length 439
13:36:22.332854 IP 142.55.1.9.80 > 142.55.154.229.3233: Flags [P.], seq 7640:7834, ack 703, win 33120, length 194
13:36:22.333433 IP 142.55.149.72.1080 > 142.55.1.9.80: Flags [P.], seq 2122:2420, ack 3915, win 64981, length 298
13:36:22.345676 IP 142.55.1.9.80 > 142.55.154.229.3235: Flags [P.], seq 1:196, ack 403, win 33120, length 195
13:36:22.353684 IP 142.55.154.229.3233 > 142.55.1.9.80: Flags [P.], seq 703:1110, ack 7834, win 15583, length 407
13:36:22.356139 IP 142.55.1.9.80 > 142.55.117.173.3784: Flags [.], seq 8586:9966, ack 883, win 33120, length 1380
13:36:22.356387 IP 142.55.1.9.80 > 142.55.117.173.3784: Flags [.], seq 9966:11346, ack 883, win 33120, length 1380
13:36:22.356507 IP 142.55.1.9.80 > 142.55.117.173.3784: Flags [P.], seq 11346:12682, ack 883, win 33120, length 1336
13:36:22.356763 IP 142.55.1.9.80 > 142.55.117.173.3784: Flags [.], seq 12682:14062, ack 883, win 33120, length 1380
13:36:22.356870 IP 142.55.154.229.3235 > 142.55.1.9.80: Flags [P.], seq 403:810, ack 196, win 16365, length 407
13:36:22.356988 IP 142.55.1.9.80 > 142.55.117.173.3784: Flags [.], seq 14062:15442, ack 883, win 33120, length 1380
13:36:22.357230 IP 142.55.117.173.3784 > 142.55.1.9.80: Flags [.], ack 12682, win 65535, length 0
13:36:22.357524 IP 142.55.1.9.80 > 142.55.117.173.3784: Flags [.], seq 15442:16822, ack 883, win 33120, length 1380
13:36:22.357535 IP 142.55.117.173.3784 > 142.55.1.9.80: Flags [.], ack 15442, win 65535, length 0
13:36:22.357901 IP 142.55.1.9.80 > 142.55.117.173.3784: Flags [.], seq 16822:18202, ack 883, win 33120, length 1380
13:36:22.358083 IP 142.55.1.9.80 > 142.55.117.173.3784: Flags [.], seq 18202:19582, ack 883, win 33120, length 1380
13:36:22.358223 IP 142.55.117.173.3784 > 142.55.1.9.80: Flags [.], ack 18202, win 65535, length 0
13:36:22.358475 IP 142.55.1.9.80 > 142.55.117.173.3784: Flags [.], seq 19582:20962, ack 883, win 33120, length 1380
13:36:22.358844 IP 142.55.1.9.80 > 142.55.117.173.3784: Flags [.], seq 20962:22342, ack 883, win 33120, length 1380
13:36:22.358967 IP 142.55.1.9.80 > 142.55.117.173.3784: Flags [.], seq 22342:23722, ack 883, win 33120, length 1380
13:36:22.359095 IP 142.55.117.173.3784 > 142.55.1.9.80: Flags [.], ack 20962, win 65535, length 0
13:36:22.359214 IP 142.55.1.9.80 > 142.55.117.173.3784: Flags [.], seq 23722:25102, ack 883, win 33120, length 1380
13:36:22.359349 IP 142.55.1.9.80 > 142.55.117.173.3784: Flags [.], seq 25102:26482, ack 883, win 33120, length 1380
13:36:22.359351 IP 142.55.117.173.3784 > 142.55.1.9.80: Flags [.], ack 23722, win 65535, length 0
13:36:22.359473 IP 142.55.1.9.80 > 142.55.117.173.3784: Flags [.], seq 26482:27862, ack 883, win 33120, length 1380
13:36:22.359595 IP 142.55.1.9.80 > 142.55.117.173.3784: Flags [.], seq 27862:29242, ack 883, win 33120, length 1380
13:36:22.359713 IP 142.55.1.9.80 > 142.55.117.173.3784: Flags [.], seq 29242:30622, ack 883, win 33120, length 1380
13:36:22.359837 IP 142.55.1.9.80 > 142.55.117.173.3784: Flags [.], seq 30622:32002, ack 883, win 33120, length 1380
13:36:22.359838 IP 142.55.117.173.3784 > 142.55.1.9.80: Flags [.], ack 27862, win 65535, length 0
13:36:22.359960 IP 142.55.1.9.80 > 142.55.117.173.3784: Flags [.], seq 32002:33382, ack 883, win 33120, length 1380
13:36:22.360456 IP 142.55.117.173.3784 > 142.55.1.9.80: Flags [.], ack 32002, win 61395, length 0
13:36:22.360832 IP 142.55.1.9.80 > 142.55.117.173.3784: Flags [.], seq 33382:34762, ack 883, win 33120, length 1380
13:36:22.360951 IP 142.55.1.9.80 > 142.55.117.173.3784: Flags [.], seq 34762:36142, ack 883, win 33120, length 1380
13:36:22.361196 IP 142.55.1.9.80 > 142.55.117.173.3784: Flags [.], seq 36142:37522, ack 883, win 33120, length 1380
13:36:22.361314 IP 142.55.1.9.80 > 142.55.117.173.3784: Flags [.], seq 37522:38902, ack 883, win 33120, length 1380
13:36:22.361330 IP 142.55.117.173.3784 > 142.55.1.9.80: Flags [.], ack 34762, win 58635, length 0
13:36:22.361596 IP 142.55.117.173.3784 > 142.55.1.9.80: Flags [.], ack 38902, win 54495, length 0
13:36:22.361718 IP 142.55.1.9.80 > 142.55.117.173.3784: Flags [.], seq 38902:40282, ack 883, win 33120, length 1380
13:36:22.361835 IP 142.55.1.9.80 > 142.55.117.173.3784: Flags [.], seq 40282:41662, ack 883, win 33120, length 1380
13:36:22.361836 IP 142.55.1.9.80 > 142.55.117.173.3784: Flags [P.], seq 41662:41677, ack 883, win 33120, length 15
13:36:22.362438 IP 142.55.117.173.3784 > 142.55.1.9.80: Flags [.], ack 41677, win 51720, length 0
13:36:22.364321 IP 142.55.201.129.3838 > 142.55.1.9.80: Flags [S], seq 3491644945, win 65535, options [mss 1460,nop,nop,sackOK], length 0
13:36:22.365067 IP 142.55.1.9.80 > 142.55.154.229.3233: Flags [P.], seq 7834:8027, ack 1110, win 33120, length 193
13:36:22.365138 IP 142.55.1.9.80 > 142.55.201.129.3838: Flags [S.], seq 2007009327, ack 3491644946, win 1380, options [mss 1380], length 0
13:36:22.365339 IP 142.55.201.129.3838 > 142.55.1.9.80: Flags [.], ack 1, win 65535, length 0
13:36:22.367879 IP 142.55.191.187.3074 > 142.55.1.0.445: Flags [S], seq 2826282297, win 65535, options [mss 1460,nop,nop,sackOK], length 0
13:36:22.370135 IP 142.55.117.173.3784 > 142.55.1.9.80: Flags [.], ack 41677, win 65535, length 0
13:36:22.371001 IP 142.55.154.229.3233 > 142.55.1.9.80: Flags [P.], seq 1110:1472, ack 8027, win 15390, length 362
13:36:22.377089 IP 142.55.1.9.80 > 142.55.154.229.3235: Flags [P.], seq 196:389, ack 810, win 33120, length 193
13:36:22.380582 IP 142.55.1.9.80 > 142.55.149.106.1591: Flags [P.], seq 1129:1690, ack 675, win 33120, length 561
13:36:22.382197 IP 142.55.149.106.1591 > 142.55.1.9.80: Flags [P.], seq 675:1013, ack 1690, win 64974, length 338
13:36:22.385270 IP 142.55.1.9.80 > 142.55.154.229.3233: Flags [P.], seq 8027:8223, ack 1472, win 33120, length 196
13:36:22.386782 IP 142.55.154.229.3235 > 142.55.1.9.80: Flags [P.], seq 810:1227, ack 389, win 16172, length 417
13:36:22.390738 IP 142.55.154.229.3233 > 142.55.1.9.80: Flags [P.], seq 1472:1873, ack 8223, win 15194, length 401
13:36:22.390892 IP 142.55.1.9.80 > 142.55.112.187.2107: Flags [P.], seq 1108:1662, ack 565, win 33120, length 554
13:36:22.392911 IP 142.55.112.187.2107 > 142.55.1.9.80: Flags [P.], seq 565:847, ack 1662, win 65535, length 282
13:36:22.395325 IP 142.55.1.9.80 > 142.55.112.187.2107: Flags [.], ack 847, win 32838, length 0
13:36:22.395784 IP 142.55.1.9.80 > 142.55.149.106.1591: Flags [.], ack 1013, win 32782, length 0
13:36:22.395794 IP 142.55.1.9.80 > 142.55.112.172.1692: Flags [.], ack 1329, win 32681, length 0
13:36:22.395804 IP 142.55.1.9.80 > 142.55.117.187.4079: Flags [.], ack 895, win 32822, length 0
13:36:22.395805 IP 142.55.1.9.80 > 142.55.154.229.3235: Flags [.], ack 1227, win 32703, length 0
13:36:22.395815 IP 142.55.1.9.80 > 142.55.154.229.3233: Flags [.], ack 1873, win 32719, length 0
13:36:22.395824 IP 142.55.1.9.80 > 142.55.112.187.2108: Flags [.], ack 1134, win 32838, length 0
13:36:22.395826 IP 142.55.1.9.80 > 142.55.194.131.2213: Flags [.], ack 649, win 32796, length 0
13:36:22.395837 IP 142.55.1.9.80 > 142.55.149.68.1340: Flags [.], ack 795, win 33120, length 0
13:36:22.395838 IP 142.55.1.9.80 > 142.55.149.68.1339: Flags [.], ack 794, win 33120, length 0
13:36:22.395847 IP 142.55.1.9.80 > 142.55.194.131.2214: Flags [.], ack 973, win 32796, length 0
13:36:22.395861 IP 142.55.1.9.80 > 142.55.149.72.1080: Flags [.], ack 2420, win 32822, length 0
13:36:22.395879 IP 142.55.1.9.80 > 142.55.113.197.2287: Flags [.], ack 898, win 32824, length 0
13:36:22.395888 IP 142.55.1.9.80 > 142.55.149.72.1083: Flags [.], ack 2120, win 33120, length 0
13:36:22.402041 IP 142.55.225.14.4110 > 142.55.1.96.445: Flags [S], seq 3555377620, win 16384, options [mss 1460,nop,nop,sackOK], length 0
13:36:22.405431 IP 142.55.211.156.1166 > 142.55.1.9.80: Flags [P.], seq 324:646, ack 1142, win 16560, length 322
13:36:22.405457 IP 142.55.1.9.80 > 142.55.154.229.3233: Flags [P.], seq 8223:8417, ack 1873, win 33120, length 194
13:36:22.406789 IP 142.55.211.156.1165 > 142.55.1.9.80: Flags [P.], seq 325:649, ack 1141, win 15419, length 324
13:36:22.410180 IP 142.55.23.201.4966 > 142.55.1.70.445: Flags [S], seq 627873689, win 64240, options [mss 1460,nop,nop,sackOK], length 0
13:36:22.427488 IP 142.55.1.9.80 > 142.55.211.156.1166: Flags [P.], seq 1142:1712, ack 646, win 33120, length 570
13:36:22.434129 IP 142.55.1.9.80 > 142.55.117.186.1794: Flags [P.], seq 1108:1662, ack 659, win 33120, length 554
13:36:22.435588 IP 142.55.117.186.1794 > 142.55.1.9.80: Flags [P.], seq 659:988, ack 1662, win 64427, length 329
13:36:22.435757 IP 142.55.1.9.80 > 142.55.211.156.1165: Flags [P.], seq 1141:1713, ack 649, win 33120, length 572
13:36:22.437268 IP 142.55.1.9.80 > 142.55.242.52.4095: Flags [P.], seq 560:1112, ack 460, win 33120, length 552
13:36:22.437799 IP 142.55.186.239.1220 > 142.55.1.9.80: Flags [S], seq 2723283978, win 64240, options [mss 1460,nop,nop,sackOK], length 0
13:36:22.438708 IP 142.55.186.239.1221 > 142.55.1.9.80: Flags [S], seq 2723344579, win 64240, options [mss 1460,nop,nop,sackOK], length 0
13:36:22.439194 IP 142.55.1.9.80 > 142.55.186.239.1220: Flags [S.], seq 2007074220, ack 2723283979, win 1380, options [mss 1380], length 0
13:36:22.439789 IP 142.55.1.9.80 > 142.55.186.239.1221: Flags [S.], seq 2007139014, ack 2723344580, win 1380, options [mss 1380], length 0
13:36:22.439830 IP 142.55.186.239.1220 > 142.55.1.9.80: Flags [.], ack 1, win 64860, length 0
13:36:22.440466 IP 142.55.186.239.1220 > 142.55.1.9.80: Flags [P.], seq 1:279, ack 1, win 64860, length 278
13:36:22.440492 IP 142.55.186.239.1221 > 142.55.1.9.80: Flags [.], ack 1, win 64860, length 0
13:36:22.440686 IP 142.55.186.239.1221 > 142.55.1.9.80: Flags [P.], seq 1:279, ack 1, win 64860, length 278
13:36:22.445291 IP 142.55.154.229.3233 > 142.55.1.9.80: Flags [P.], seq 1873:2278, ack 8417, win 16560, length 405
13:36:22.446218 IP 142.55.242.52.4095 > 142.55.1.9.80: Flags [P.], seq 460:918, ack 1112, win 64983, length 458
13:36:22.449348 IP 142.55.1.9.80 > 142.55.117.173.3783: Flags [.], seq 10599:11979, ack 309, win 33120, length 1380
13:36:22.449583 IP 142.55.1.9.80 > 142.55.117.173.3783: Flags [P.], seq 11979:13280, ack 309, win 33120, length 1301
13:36:22.449901 IP 142.55.117.173.3783 > 142.55.1.9.80: Flags [.], ack 13280, win 65535, length 0
13:36:22.451634 IP 142.55.1.9.80 > 142.55.149.72.1083: Flags [P.], seq 3359:3913, ack 2120, win 33120, length 554
13:36:22.457010 IP 142.55.1.9.80 > 142.55.154.229.3233: Flags [P.], seq 8417:8612, ack 2278, win 33120, length 195
13:36:22.457639 IP 142.55.211.156.1166 > 142.55.1.9.80: Flags [P.], seq 646:959, ack 1712, win 15990, length 313
13:36:22.458444 IP 142.55.211.156.1165 > 142.55.1.9.80: Flags [P.], seq 649:960, ack 1713, win 16560, length 311
13:36:22.459711 IP 142.55.1.9.80 > 142.55.113.197.2288: Flags [P.], seq 1108:1672, ack 607, win 33120, length 564
13:36:22.461297 IP 142.55.113.197.2288 > 142.55.1.9.80: Flags [P.], seq 607:902, ack 1672, win 64417, length 295
13:36:22.462814 IP 142.55.149.72.1083 > 142.55.1.9.80: Flags [P.], seq 2120:2423, ack 3913, win 65535, length 303
13:36:22.464469 IP 142.55.117.173.3783 > 142.55.1.9.80: Flags [P.], seq 309:621, ack 13280, win 65535, length 312
13:36:22.465488 IP 142.55.154.229.3233 > 142.55.1.9.80: Flags [P.], seq 2278:2695, ack 8612, win 16365, length 417
13:36:22.470163 IP 142.55.1.9.80 > 142.55.211.156.1166: Flags [P.], seq 1712:2273, ack 959, win 33120, length 561
13:36:22.475065 IP 142.55.1.9.80 > 142.55.149.68.1340: Flags [P.], seq 195:388, ack 795, win 33120, length 193
13:36:22.478668 IP 142.55.1.9.80 > 142.55.149.68.1339: Flags [P.], seq 388:581, ack 794, win 33120, length 193
13:36:22.478761 IP 142.55.211.156.1166 > 142.55.1.9.80: Flags [P.], seq 959:1272, ack 2273, win 15429, length 313
13:36:22.479844 IP 142.55.149.68.1340 > 142.55.1.9.80: Flags [P.], seq 795:1149, ack 388, win 64952, length 354
13:36:22.480676 IP 142.55.1.9.80 > 142.55.154.229.3233: Flags [P.], seq 8612:8805, ack 2695, win 33120, length 193
13:36:22.481606 IP 142.55.149.68.1339 > 142.55.1.9.80: Flags [P.], seq 794:1203, ack 581, win 64760, length 409
13:36:22.481656 IP 142.55.1.9.80 > 142.55.117.186.1795: Flags [P.], seq 1108:1667, ack 664, win 33120, length 559
13:36:22.482981 IP 142.55.117.186.1795 > 142.55.1.9.80: Flags [P.], seq 664:993, ack 1667, win 64976, length 329
13:36:22.486362 IP 142.55.154.229.3233 > 142.55.1.9.80: Flags [P.], seq 2695:3100, ack 8805, win 16172, length 405
13:36:22.495964 IP 142.55.1.9.80 > 142.55.251.172.1164: Flags [S.], seq 2002565624, ack 2165356067, win 1380, options [mss 1380], length 0
13:36:22.497836 IP 142.55.209.186.3207 > 142.55.1.9.80: Flags [.], ack 1122, win 16560, length 0
13:36:22.501462 IP 142.55.1.9.80 > 142.55.154.229.3233: Flags [P.], seq 8805:9000, ack 3100, win 33120, length 195
13:36:22.506504 IP 142.55.154.229.3233 > 142.55.1.9.80: Flags [P.], seq 3100:3504, ack 9000, win 15977, length 404
13:36:22.511490 IP 142.55.1.9.80 > 142.55.194.131.2214: Flags [P.], seq 1662:2216, ack 973, win 33120, length 554
13:36:22.512053 IP 142.55.1.9.80 > 142.55.117.187.4080: Flags [P.], seq 1117:1671, ack 902, win 33120, length 554
13:36:22.513412 IP 142.55.117.187.4080 > 142.55.1.9.80: Flags [P.], seq 902:1200, ack 1671, win 65535, length 298
13:36:22.515181 IP 142.55.1.9.80 > 142.55.242.52.4094: Flags [P.], seq 1118:1671, ack 932, win 33120, length 553
13:36:22.515232 IP 142.55.1.9.80 > 142.55.194.76.3956: Flags [P.], seq 1699:2270, ack 959, win 33120, length 571
13:36:22.516868 IP 142.55.194.131.2214 > 142.55.1.9.80: Flags [P.], seq 973:1297, ack 2216, win 16006, length 324
13:36:22.521311 IP 142.55.242.52.4094 > 142.55.1.9.80: Flags [P.], seq 932:1406, ack 1671, win 64418, length 474
13:36:22.526622 IP 142.55.1.9.80 > 142.55.242.52.4095: Flags [P.], seq 1112:1663, ack 918, win 33120, length 551
13:36:22.526673 IP 142.55.1.9.80 > 142.55.194.131.2213: Flags [P.], seq 1116:1670, ack 649, win 33120, length 554
13:36:22.527290 IP 142.55.242.52.4095 > 142.55.1.9.80: Flags [P.], seq 918:1390, ack 1663, win 64432, length 472
13:36:22.528198 IP 142.55.194.131.2213 > 142.55.1.9.80: Flags [P.], seq 649:978, ack 1670, win 16560, length 329
13:36:22.532436 IP 142.55.23.233.3762 > 142.55.1.184.445: Flags [S], seq 1708938838, win 64240, options [mss 1460,nop,nop,sackOK], length 0
13:36:22.536551 IP 142.55.1.9.80 > 142.55.112.187.2108: Flags [P.], seq 2221:2775, ack 1134, win 33120, length 554
13:36:22.536608 IP 142.55.1.9.80 > 142.55.149.72.1083: Flags [P.], seq 3913:4472, ack 2423, win 33120, length 559
13:36:22.537791 IP 142.55.1.9.80 > 142.55.194.76.3954: Flags [P.], seq 1135:1704, ack 640, win 33120, length 569
13:36:22.538591 IP 142.55.112.187.2108 > 142.55.1.9.80: Flags [P.], seq 1134:1416, ack 2775, win 65535, length 282
13:36:22.540470 IP 142.55.149.72.1083 > 142.55.1.9.80: Flags [P.], seq 2423:2721, ack 4472, win 64976, length 298
13:36:22.543385 IP 142.55.115.42.1097 > 142.55.1.96.445: Flags [S], seq 355427574, win 65535, options [mss 1460,nop,nop,sackOK], length 0
13:36:22.549665 IP 142.55.194.76.3954 > 142.55.1.9.80: Flags [P.], seq 640:962, ack 1704, win 15423, length 322
13:36:22.550031 IP 142.55.194.76.3956 > 142.55.1.9.80: Flags [P.], seq 959:1282, ack 2270, win 15989, length 323
13:36:22.551546 IP 142.55.201.129.3838 > 142.55.1.9.80: Flags [P.], seq 1:420, ack 1, win 65535, length 419
13:36:22.552720 IP 142.55.1.9.80 > 142.55.149.72.1080: Flags [P.], seq 3915:4469, ack 2420, win 33120, length 554
13:36:22.554756 IP 142.55.149.72.1080 > 142.55.1.9.80: Flags [P.], seq 2420:2718, ack 4469, win 64427, length 298
13:36:22.564770 IP 142.55.1.9.80 > 142.55.149.68.1340: Flags [P.], seq 388:584, ack 1149, win 33120, length 196
13:36:22.566514 IP 142.55.149.68.1340 > 142.55.1.9.80: Flags [P.], seq 1149:1542, ack 584, win 64756, length 393
13:36:22.569909 IP 142.55.1.9.80 > 142.55.201.129.3838: Flags [P.], seq 1:195, ack 420, win 33120, length 194
13:36:22.579652 IP 142.55.1.9.80 > 142.55.186.239.1220: Flags [P.], seq 1:570, ack 279, win 33120, length 569
13:36:22.580809 IP 142.55.186.239.1220 > 142.55.1.9.80: Flags [P.], seq 279:557, ack 570, win 64291, length 278
13:36:22.585623 IP 142.55.1.9.80 > 142.55.149.106.1593: Flags [P.], seq 559:1121, ack 339, win 33120, length 562
13:36:22.588695 IP 142.55.1.9.80 > 142.55.112.187.2107: Flags [P.], seq 1662:2216, ack 847, win 33120, length 554
13:36:22.589204 IP 142.55.1.9.80 > 142.55.186.239.1221: Flags [P.], seq 1:570, ack 279, win 33120, length 569
13:36:22.590134 IP 142.55.1.9.80 > 142.55.54.179.1328: Flags [F.], seq 1985350953, ack 1703346494, win 33120, length 0
13:36:22.590386 IP 142.55.186.239.1221 > 142.55.1.9.80: Flags [P.], seq 279:557, ack 570, win 64291, length 278
13:36:22.590387 IP 142.55.54.179.1328 > 142.55.1.9.80: Flags [.], ack 1, win 64471, length 0
13:36:22.590816 IP 142.55.112.187.2107 > 142.55.1.9.80: Flags [P.], seq 847:1129, ack 2216, win 64981, length 282
13:36:22.591075 IP 142.55.1.9.80 > 142.55.117.160.1522: Flags [F.], seq 1986793267, ack 797451518, win 33120, length 0
13:36:22.591234 IP 142.55.1.9.80 > 142.55.117.160.1523: Flags [F.], seq 1986887923, ack 3669930857, win 33120, length 0
13:36:22.591391 IP 142.55.117.160.1522 > 142.55.1.9.80: Flags [.], ack 1, win 65535, length 0
13:36:22.591595 IP 142.55.117.160.1523 > 142.55.1.9.80: Flags [.], ack 1, win 64837, length 0
13:36:22.598200 IP 142.55.1.9.80 > 142.55.149.72.1080: Flags [.], ack 2718, win 32822, length 0
13:36:22.598271 IP 142.55.1.9.80 > 142.55.194.76.3956: Flags [.], ack 1282, win 32797, length 0
13:36:22.598281 IP 142.55.1.9.80 > 142.55.194.76.3954: Flags [.], ack 962, win 32798, length 0
13:36:22.598290 IP 142.55.1.9.80 > 142.55.112.187.2108: Flags [.], ack 1416, win 32838, length 0
13:36:22.598292 IP 142.55.1.9.80 > 142.55.194.131.2213: Flags [.], ack 978, win 32791, length 0
13:36:22.598302 IP 142.55.1.9.80 > 142.55.242.52.4094: Flags [.], ack 1406, win 33120, length 0
13:36:22.598304 IP 142.55.1.9.80 > 142.55.194.131.2214: Flags [.], ack 1297, win 32796, length 0
13:36:22.598314 IP 142.55.1.9.80 > 142.55.117.187.4080: Flags [.], ack 1200, win 32822, length 0
13:36:22.598324 IP 142.55.1.9.80 > 142.55.117.186.1795: Flags [.], ack 993, win 33120, length 0
13:36:22.598336 IP 142.55.1.9.80 > 142.55.149.68.1339: Flags [.], ack 1203, win 33120, length 0
13:36:22.598337 IP 142.55.1.9.80 > 142.55.149.68.1340: Flags [.], ack 1542, win 32727, length 0
13:36:22.598347 IP 142.55.1.9.80 > 142.55.117.173.3783: Flags [.], ack 621, win 33120, length 0
13:36:22.598358 IP 142.55.1.9.80 > 142.55.149.72.1083: Flags [.], ack 2721, win 32822, length 0
13:36:22.598369 IP 142.55.1.9.80 > 142.55.113.197.2288: Flags [.], ack 902, win 32825, length 0
13:36:22.598382 IP 142.55.1.9.80 > 142.55.242.52.4095: Flags [.], ack 1390, win 32648, length 0
13:36:22.598397 IP 142.55.1.9.80 > 142.55.154.229.3233: Flags [.], ack 3504, win 32716, length 0
13:36:22.598445 IP 142.55.1.9.80 > 142.55.186.239.1221: Flags [.], ack 557, win 32842, length 0
13:36:22.598739 IP 142.55.1.9.80 > 142.55.186.239.1220: Flags [.], ack 557, win 33120, length 0
13:36:22.598749 IP 142.55.1.9.80 > 142.55.117.186.1794: Flags [.], ack 988, win 33120, length 0
13:36:22.598758 IP 142.55.1.9.80 > 142.55.211.156.1165: Flags [.], ack 960, win 32809, length 0
13:36:22.598759 IP 142.55.1.9.80 > 142.55.211.156.1166: Flags [.], ack 1272, win 32807, length 0
13:36:22.598983 IP 142.55.149.106.1593 > 142.55.1.9.80: Flags [P.], seq 339:669, ack 1121, win 64414, length 330
13:36:22.602893 IP 142.55.1.9.80 > 142.55.186.239.1220: Flags [P.], seq 570:1138, ack 557, win 33120, length 568
13:36:22.608227 IP 142.55.186.239.1220 > 142.55.1.9.80: Flags [P.], seq 557:826, ack 1138, win 63723, length 269
13:36:22.611100 IP 142.55.1.9.80 > 142.55.149.72.1083: Flags [P.], seq 4472:5026, ack 2721, win 33120, length 554
13:36:22.611966 IP 142.55.1.9.80 > 142.55.186.239.1221: Flags [P.], seq 570:1138, ack 557, win 33120, length 568
13:36:22.612025 IP 142.55.1.9.80 > 142.55.117.173.3783: Flags [P.], seq 13280:13619, ack 621, win 33120, length 339
13:36:22.612779 IP 142.55.186.239.1221 > 142.55.1.9.80: Flags [P.], seq 557:828, ack 1138, win 63723, length 271
13:36:22.614317 IP 142.55.149.72.1083 > 142.55.1.9.80: Flags [P.], seq 2721:3019, ack 5026, win 64422, length 298
13:36:22.622528 IP 142.55.1.9.80 > 142.55.186.239.1220: Flags [P.], seq 1138:1697, ack 826, win 33120, length 559
13:36:22.623699 IP 142.55.186.239.1220 > 142.55.1.9.80: Flags [P.], seq 826:1097, ack 1697, win 64860, length 271
13:36:22.625760 IP 142.55.117.173.3783 > 142.55.1.9.80: Flags [P.], seq 621:943, ack 13619, win 65196, length 322
13:36:22.633162 IP 142.55.1.9.80 > 142.55.149.72.1080: Flags [P.], seq 4469:5023, ack 2718, win 33120, length 554
13:36:22.633387 IP 142.55.1.9.80 > 142.55.186.239.1221: Flags [P.], seq 1138:1699, ack 828, win 33120, length 561
13:36:22.635330 IP 142.55.149.72.1080 > 142.55.1.9.80: Flags [P.], seq 2718:3016, ack 5023, win 65535, length 298
13:36:22.637500 IP 142.55.186.239.1221 > 142.55.1.9.80: Flags [P.], seq 828:1099, ack 1699, win 64860, length 271
13:36:22.642239 IP 142.55.1.9.80 > 142.55.186.239.1220: Flags [P.], seq 1697:2258, ack 1097, win 33120, length 561
13:36:22.643186 IP 142.55.186.239.1220 > 142.55.1.9.80: Flags [P.], seq 1097:1369, ack 2258, win 64299, length 272
13:36:22.655513 IP 142.55.225.14.4129 > 142.55.1.224.445: Flags [S], seq 3556177180, win 16384, options [mss 1460,nop,nop,sackOK], length 0
13:36:22.663150 IP 142.55.1.9.80 > 142.55.112.187.2107: Flags [P.], seq 2216:2770, ack 1129, win 33120, length 554
13:36:22.664445 IP 142.55.1.9.80 > 142.55.186.239.1220: Flags [P.], seq 2258:2820, ack 1369, win 33120, length 562
13:36:22.665350 IP 142.55.186.239.1220 > 142.55.1.9.80: Flags [P.], seq 1369:1641, ack 2820, win 63737, length 272
13:36:22.665589 IP 142.55.1.9.80 > 142.55.186.239.1221: Flags [P.], seq 1699:2260, ack 1099, win 33120, length 561
13:36:22.665735 IP 142.55.112.187.2107 > 142.55.1.9.80: Flags [P.], seq 1129:1411, ack 2770, win 64427, length 282
13:36:22.666751 IP 142.55.186.239.1221 > 142.55.1.9.80: Flags [P.], seq 1099:1363, ack 2260, win 64299, length 264
13:36:22.675911 IP 142.55.1.9.80 > 142.55.149.106.1593: Flags [P.], seq 1121:1675, ack 669, win 33120, length 554
13:36:22.677878 IP 142.55.149.106.1593 > 142.55.1.9.80: Flags [P.], seq 669:999, ack 1675, win 65535, length 330
13:36:22.684970 IP 142.55.1.9.80 > 142.55.186.239.1221: Flags [P.], seq 2260:2814, ack 1363, win 33120, length 554
13:36:22.686129 IP 142.55.186.239.1221 > 142.55.1.9.80: Flags [P.], seq 1363:1627, ack 2814, win 63745, length 264
13:36:22.687477 IP 142.55.1.9.80 > 142.55.117.173.3784: Flags [.], seq 41677:43057, ack 883, win 33120, length 1380
13:36:22.687668 IP 142.55.1.9.80 > 142.55.117.173.3784: Flags [.], seq 43057:44437, ack 883, win 33120, length 1380
13:36:22.688019 IP 142.55.1.9.80 > 142.55.117.173.3784: Flags [.], seq 44437:45817, ack 883, win 33120, length 1380
13:36:22.688143 IP 142.55.1.9.80 > 142.55.117.173.3784: Flags [.], seq 45817:47197, ack 883, win 33120, length 1380
13:36:22.688144 IP 142.55.117.173.3784 > 142.55.1.9.80: Flags [.], ack 44437, win 65535, length 0
13:36:22.688265 IP 142.55.1.9.80 > 142.55.117.173.3784: Flags [.], seq 47197:48577, ack 883, win 33120, length 1380
13:36:22.688395 IP 142.55.1.9.80 > 142.55.117.173.3784: Flags [P.], seq 48577:49869, ack 883, win 33120, length 1292
13:36:22.688523 IP 142.55.117.173.3784 > 142.55.1.9.80: Flags [.], ack 48577, win 65535, length 0
13:36:22.688666 IP 142.55.1.9.80 > 142.55.117.173.3784: Flags [.], seq 49869:51249, ack 883, win 33120, length 1380
13:36:22.688796 IP 142.55.1.9.80 > 142.55.117.173.3784: Flags [.], seq 51249:52629, ack 883, win 33120, length 1380
13:36:22.688978 IP 142.55.1.9.80 > 142.55.117.173.3784: Flags [.], seq 52629:54009, ack 883, win 33120, length 1380
13:36:22.689109 IP 142.55.117.173.3784 > 142.55.1.9.80: Flags [.], ack 51249, win 65535, length 0
13:36:22.689231 IP 142.55.1.9.80 > 142.55.117.173.3784: Flags [.], seq 54009:55389, ack 883, win 33120, length 1380
13:36:22.689365 IP 142.55.1.9.80 > 142.55.117.173.3784: Flags [.], seq 55389:56769, ack 883, win 33120, length 1380
13:36:22.689473 IP 142.55.1.9.80 > 142.55.117.173.3784: Flags [P.], seq 56769:58061, ack 883, win 33120, length 1292
13:36:22.689500 IP 142.55.117.173.3784 > 142.55.1.9.80: Flags [.], ack 54009, win 65535, length 0
13:36:22.689620 IP 142.55.1.9.80 > 142.55.117.173.3784: Flags [.], seq 58061:59441, ack 883, win 33120, length 1380
13:36:22.689737 IP 142.55.1.9.80 > 142.55.117.173.3784: Flags [.], seq 59441:60821, ack 883, win 33120, length 1380
13:36:22.689861 IP 142.55.117.173.3784 > 142.55.1.9.80: Flags [.], ack 56769, win 65535, length 0
13:36:22.689983 IP 142.55.1.9.80 > 142.55.117.173.3784: Flags [.], seq 60821:62201, ack 883, win 33120, length 1380
13:36:22.690022 IP 142.55.117.173.3784 > 142.55.1.9.80: Flags [.], ack 59441, win 65535, length 0
13:36:22.690292 IP 142.55.1.9.80 > 142.55.117.173.3784: Flags [.], seq 62201:63581, ack 883, win 33120, length 1380
13:36:22.690434 IP 142.55.1.9.80 > 142.55.117.173.3784: Flags [.], seq 63581:64961, ack 883, win 33120, length 1380
13:36:22.690470 IP 142.55.117.173.3784 > 142.55.1.9.80: Flags [.], ack 62201, win 65535, length 0
13:36:22.691050 IP 142.55.1.9.80 > 142.55.117.173.3784: Flags [P.], seq 64961:66253, ack 883, win 33120, length 1292
13:36:22.691061 IP 142.55.117.173.3784 > 142.55.1.9.80: Flags [.], ack 64961, win 65535, length 0
13:36:22.691188 IP 142.55.1.9.80 > 142.55.117.173.3784: Flags [.], seq 66253:67633, ack 883, win 33120, length 1380
13:36:22.691498 IP 142.55.1.9.80 > 142.55.117.173.3784: Flags [.], seq 67633:69013, ack 883, win 33120, length 1380
13:36:22.691734 IP 142.55.1.9.80 > 142.55.117.173.3784: Flags [.], seq 69013:70393, ack 883, win 33120, length 1380
13:36:22.691796 IP 142.55.117.173.3784 > 142.55.1.9.80: Flags [.], ack 67633, win 65535, length 0
13:36:22.692041 IP 142.55.1.9.80 > 142.55.117.173.3784: Flags [.], seq 70393:71773, ack 883, win 33120, length 1380
13:36:22.692291 IP 142.55.1.9.80 > 142.55.117.173.3784: Flags [.], seq 71773:73153, ack 883, win 33120, length 1380
13:36:22.692293 IP 142.55.117.173.3784 > 142.55.1.9.80: Flags [.], ack 70393, win 65535, length 0
13:36:22.692413 IP 142.55.1.9.80 > 142.55.117.173.3784: Flags [P.], seq 73153:74445, ack 883, win 33120, length 1292
13:36:22.692465 IP 142.55.1.9.80 > 142.55.149.106.1591: Flags [P.], seq 1690:2252, ack 1013, win 33120, length 562
13:36:22.692739 IP 142.55.117.173.3784 > 142.55.1.9.80: Flags [.], ack 73153, win 65535, length 0
13:36:22.693950 IP 142.55.149.106.1591 > 142.55.1.9.80: Flags [P.], seq 1013:1343, ack 2252, win 64412, length 330
13:36:22.695923 IP 142.55.1.9.80 > 142.55.186.239.1221: Flags [P.], seq 2814:3368, ack 1627, win 33120, length 554
13:36:22.700213 IP 142.55.186.239.1221 > 142.55.1.9.80: Flags [P.], seq 1627:1891, ack 3368, win 64860, length 264
13:36:22.703951 IP 142.55.1.9.80 > 142.55.149.68.1339: Flags [P.], seq 581:774, ack 1203, win 33120, length 193
13:36:22.707690 IP 142.55.1.9.80 > 142.55.117.186.1794: Flags [P.], seq 1662:2216, ack 988, win 33120, length 554
13:36:22.709949 IP 142.55.1.9.80 > 142.55.113.197.2287: Flags [P.], seq 1667:2219, ack 898, win 33120, length 552
13:36:22.710890 IP 142.55.1.9.80 > 142.55.242.52.4094: Flags [P.], seq 1671:2238, ack 1406, win 33120, length 567
13:36:22.711959 IP 142.55.117.186.1794 > 142.55.1.9.80: Flags [P.], seq 988:1317, ack 2216, win 65535, length 329
13:36:22.712265 IP 142.55.113.197.2287 > 142.55.1.9.80: Flags [P.], seq 898:1209, ack 2219, win 64983, length 311
13:36:22.719900 IP 142.55.242.52.4094 > 142.55.1.9.80: Flags [P.], seq 1406:1880, ack 2238, win 65535, length 474
13:36:22.731830 IP 142.55.1.9.80 > 142.55.149.72.1080: Flags [P.], seq 5023:5577, ack 3016, win 33120, length 554
13:36:22.732262 IP 142.55.1.9.80 > 142.55.149.68.1340: Flags [P.], seq 584:778, ack 1542, win 33120, length 194
13:36:22.739303 IP 142.55.1.9.80 > 142.55.117.187.4080: Flags [P.], seq 1671:2225, ack 1200, win 33120, length 554
13:36:22.740489 IP 142.55.201.129.3838 > 142.55.1.9.80: Flags [.], ack 195, win 65341, length 0
13:36:22.740638 IP 142.55.117.187.4080 > 142.55.1.9.80: Flags [P.], seq 1200:1498, ack 2225, win 64981, length 298
13:36:22.742686 IP 142.55.149.72.1080 > 142.55.1.9.80: Flags [P.], seq 3016:3314, ack 5577, win 64981, length 298
13:36:22.748068 IP 142.55.1.9.80 > 142.55.112.187.2107: Flags [P.], seq 2770:3324, ack 1411, win 33120, length 554
13:36:22.751017 IP 142.55.112.187.2107 > 142.55.1.9.80: Flags [P.], seq 1411:1693, ack 3324, win 65535, length 282
13:36:22.752102 IP 142.55.149.68.1339 > 142.55.1.9.80: Flags [P.], seq 1203:1600, ack 774, win 64567, length 397
13:36:22.755088 IP 142.55.149.68.1340 > 142.55.1.9.80: Flags [P.], seq 1542:1951, ack 778, win 64562, length 409
13:36:22.758271 IP 142.55.1.9.80 > 142.55.149.106.1593: Flags [P.], seq 1675:2229, ack 999, win 33120, length 554
13:36:22.759048 IP 142.55.1.9.80 > 142.55.117.173.3783: Flags [P.], seq 13619:13958, ack 943, win 33120, length 339
13:36:22.760052 IP 142.55.149.106.1593 > 142.55.1.9.80: Flags [P.], seq 999:1329, ack 2229, win 64981, length 330
13:36:22.760783 IP 142.55.1.9.80 > 142.55.112.187.2108: Flags [P.], seq 2775:3329, ack 1416, win 33120, length 554
13:36:22.765858 IP 142.55.112.187.2108 > 142.55.1.9.80: Flags [P.], seq 1416:1698, ack 3329, win 64981, length 282
13:36:22.766866 IP 142.55.117.173.3783 > 142.55.1.9.80: Flags [P.], seq 943:1248, ack 13958, win 64857, length 305
13:36:22.770267 IP 142.55.1.9.80 > 142.55.194.76.3954: Flags [P.], seq 1704:2275, ack 962, win 33120, length 571
13:36:22.772375 IP 142.55.194.76.3954 > 142.55.1.9.80: Flags [P.], seq 962:1283, ack 2275, win 16560, length 321
13:36:22.780424 IP 142.55.1.9.80 > 142.55.194.76.3956: Flags [P.], seq 2270:2842, ack 1282, win 33120, length 572
13:36:22.781830 IP 142.55.1.9.80 > 142.55.186.239.1220: Flags [P.], seq 2820:3382, ack 1641, win 33120, length 562
13:36:22.782427 IP 142.55.194.76.3956 > 142.55.1.9.80: Flags [P.], seq 1282:1605, ack 2842, win 15417, length 323
13:36:22.782809 IP 142.55.1.9.80 > 142.55.149.106.1591: Flags [P.], seq 2252:2806, ack 1343, win 33120, length 554
13:36:22.783341 IP 142.55.186.239.1220 > 142.55.1.9.80: Flags [P.], seq 1641:1905, ack 3382, win 64860, length 264
13:36:22.784248 IP 142.55.1.9.80 > 142.55.117.173.3784: Flags [.], seq 74445:75825, ack 883, win 33120, length 1380
13:36:22.784453 IP 142.55.1.9.80 > 142.55.117.173.3784: Flags [.], seq 75825:77205, ack 883, win 33120, length 1380
13:36:22.784486 IP 142.55.149.106.1591 > 142.55.1.9.80: Flags [P.], seq 1343:1673, ack 2806, win 65535, length 330
